post_126308,Лайтпак 5.5 опубликован,atarity,+290,3207,165,0
post_206730,Яндекс посвятил страницу плееру Winamp,Zalina,+289,65669,185,0
post_163637,Робот-пылесос Kärcher RC 3000: опыт эксплуатации,hdablin,+289,185491,540,0
post_120425,Интерфейс банкоматов Сбербанка 4 месяца спустя,samat,+289,1712,8,0
post_130361,Имена людей и интерфейс,FakeFactFelis,+288,5249,465,0
post_107251,Фотографируем Солнце,tau,+288,5108,115,0
post_136853,Восстановление расфокусированных и смазанных изображений,YUVladimir,+287,52978,759,0
post_82670,Распространенные заблуждения про банковские карточки,begoon,+287,21298,182,0
post_74442,Новый конкурс Вконтакте — наглый обман,furyk,+287,2219,8,0
post_133741,Фоторама,artpolikarpov,+286,11306,741,0
post_128642,Рутрекеру — 7 лет,rutracker,+285,1335,3,0
post_112449,Определение местоположения отключенного телефона: миф?,AVET,+285,39010,112,0
post_91665,Программизм: история одной болезни,mace,+285,2493,129,0
post_150661,Расставляем точки на Li: Нужна ли тренировка литиевых аккумуляторов?,vvzvlad,+284,221793,1034,0
post_143834,Взломать Wi-Fi за 10 часов,gorl,+284,726314,2845,0
post_112608,Остросюжетный обзор DESTEN Cyberbook U872,Boomburum,+284,65999,49,0
post_164175,Технология быстрого создания фонов для 2D-игр на базе 3D-заготовок (48 часов разработки),Weilard,+283,89207,1030,0
post_181013,17-летний подросток опубликовал 0day XSS в PayPal после того comma  как ему отказали в вознаграждении,ValdikSS,+282,160103,53,0
post_167677,Как превратить браузер в notepad за 1 секунду,SLY_G,+282,105173,858,0
post_158345,Рутрекер занесен в реестр РосКомНадзора,rutracker,+282,180206,68,0
post_63854,Ломаем капчу,1div,+282,18937,150,0
post_80732,Сдача сессии по-английски,kachkaev,+281,3182,130,0
post_79696,Вам календарик 2010,anatoly_rr,+281,1341,126,0
post_131305,Почти идеальная схема мошенничества с использованием webmoney,FladeX,+280,14297,80,0
post_109269,Ну что же ты comma  Google,winzard,+280,5155,14,0
post_133303,Алгоритм сортировки Timsort,Infopulse_Ukraine,+279,42911,786,0
post_216637,Карточные игры,UserSide,+278,98328,428,0
post_158565,Opportunity – позабытый рекордсмен,Zelenyikot,+278,58094,112,0
post_126409,Множественные CSRF уязвимости в крупнейших порталах Рунета,Graphite,+278,5683,217,0
post_116720,Делаем качественный переплёт для любимой книги,LongFireDemon,+278,56060,452,0
post_112321,Полулегальное воровство печеньками,XMLshop,+278,35376,264,0
post_101028,Живая каркасная модель мотоцикла,podust,+278,1851,25,0
post_62109,ЕГЭ изнутри (глазами админа),beliyadm,+278,3644,72,0
post_124054,Epic Fail от IDA и Eset,gjf,+277,16070,78,0
post_107637,Here be dragons: Управление памятью в Windows как оно есть [3/3],amirul,+277,36237,347,0
post_101271,Опубликовано доказательство P ≠ NP?,vimmer,+277,9835,55,0
post_146489,Я презираю Arduino,aronsky,+276,71831,613,0
post_122551,А знаете ли вы comma  что…,voodee,+276,1382,34,0
post_120286,Алексей Навальный представил интернет-проект для борьбы с ямами на дорогах,aleksandrit,+276,1056,35,0
post_216439,Самодельные цифровые солнечные часы,SMihalkov,+275,81282,284,0
post_204580,Обновление Яндекс Диска привело к неработоспособности Windows и программ,aivus,+275,235350,109,0
post_177347,Клавиатура своими руками под свои руки,philpirj,+275,77025,324,0
post_165531,Звезда Смерти не нужна когда есть Curiosity,Zelenyikot,+275,117196,127,0
post_139819,Фобос-Грунт. Уроки для оставшихся на Земле,track,+275,6827,177,0
post_125564,Достала избыточность С++,nrcpp,+275,4234,117,0
post_116291,10 фактов про леммингов comma  о которых вы даже не подозревали,ThePretender,+275,3800,217,0
post_160615,In Soviet Russia… Apple не удалось зарегистрировать торговую марку для iPad в Роспатенте,de1337ed,+274,117858,39,0
post_158613,Microsoft Surface: три недели вместе с самым противоречивым планшетным компьютером,vilianov,+274,209093,129,0
post_134862,Взлом с продолжением,mangust59,+274,13837,238,0
post_115451,О том comma  как я заставлял Ubuntu работать 10 часов от батареи,Zevaka,+274,56655,797,0
post_193554,Отличный ход comma  QIWI!,Terehoff,+273,178533,38,0
post_189750,Псевдоскоп comma  или что если поменять глаза местами,kefiijrw,+272,150837,333,0
post_163831,Удивительный Марс,Zelenyikot,+272,79127,171,0
post_163689,Миникомпьютер из роутера с OpenWRT: разрабатываем USB-видеокарту,Ariman,+272,118556,825,0
post_119324,Полностью автономная камера наблюдения,apple_fan,+272,17347,303,0
post_37013,Эксперимент №1. Сколько орешков в тарелке?,naz2,+272,1350,21,0
post_198896,Юзабилити посадочного талона: как спасти две человеческие жизни в год,vorotila,+271,130486,194,0
post_101810,Пишем свою ОС: Выпуск 1,iley,+271,29705,442,0
post_203490,Почему 98% текстов на ваших сайтах не работают. Вообще. И как это починить,Milfgard,+270,171708,1523,0
post_65384,pv — маленькая comma  но очень полезная утилита,Yur4eg,+270,10439,498,0
post_59533,Основатель Pirate Bay призывает наказать юристов IFPI денежной DDo$-атакой,yrygvay,+270,1430,20,0
post_216991,Регистрация сайтов: теперь за 1000 рублей,mgremlin,+269,94303,68,0
post_194774,Самый крутой системный блок для PC (сделай сам),Meelexx,+269,218238,569,0
post_169339,Чем плох свой Open Source проект,dzaporozhets,+269,60930,194,0
post_167523,Термоядерная энергетика: надежда человечества?,BarsMonster,+269,125933,373,0
post_157447,Рендер Diablo3. Как это работает,UrsusDominatus,+269,91394,455,0
post_144741,Единственный способ,tangro,+269,66512,380,0
post_130782,24-летний студент начал войну против Facebook,alizar,+269,24048,144,0
post_129171,Легкий способ бросить писать идеальный код,jlbyrey,+269,7596,523,0
post_83989,Жизнь и развитие IE6 в комиксе,TecHMeaT,+269,2795,54,0
post_74263,Как увели мои деньги с кошелька Яндекса. Часть 1,fromrussia,+269,12160,42,0
post_86939,Про хакеров comma  кадабру и ТМ,aLexusPro,+268,604,22,0
post_118954,Старый comma  но еще рабочий 286,Linol,+267,6798,92,0
post_78311,Почему RAID-5 — «mustdie»?,track,+267,40936,221,0
post_179577,Как работает «Освободитель» (Да-да comma  мы напечатали пистолет),vvzvlad,+266,212409,197,0
post_118208,Пора завязывать использовать пробелы вместо табуляции в коде,TheShock,+266,11585,105,0
post_50690,Panasonic атакует,g0ff,+266,4460,104,0
post_148782,Как я покупал квартиру,ffriend,+265,26294,797,0
post_129101,Почему в WiMax и LTE используют OFDM,tgx,+265,27649,353,1
post_110899,Апгрэйд «мыльницы» до микроскопа,Azya,+265,6797,180,0
post_101346,Генерирование изображений-заглушек,stansult,+265,4301,354,0
post_20588,Чёрточки: только ли тире comma  минус и дефис?,besisland,+265,31499,937,0
post_191084,Ко дню рождения Мастдайки,Antikiller,+264,95542,174,0
post_129232,Уникальная схема взлома мобильных телефонов в России — как это работало,EldarMurtazin,+264,12429,87,0
post_123856,Статистика по профилям пользователей ВКонтакте,belk,+264,32779,236,0
post_106387,Грабли при верстке HTML писем,latrekc,+264,23320,920,0
post_82544,Сравнение кодеков libtheora и x264,XaLBa,+264,1936,37,0
post_183722,Дизайнер на кладбище,Marchevsky,+263,81358,55,0
post_181265,Необыкновенный способ генерации лабиринтов,Thoughteer,+263,53932,809,0
post_171273,Мифы нашего времени: генетически модифицированные организмы. Так ли страшен черт?,viktorious,+263,197458,920,0
post_75248,Дао Вебсервиса. (Или да хватит же изобретать велосипеды!),el777,+263,9595,451,0
post_165967,Разработчик передал свою работу на аутсорсинг в Китай и проводил время на Reddit,FakeFactFelis,+262,176558,176,0
post_161223,Жизни нет comma  населена роботами,Zelenyikot,+262,102507,126,0
post_143169,Взгляд изнутри: матрицы цифровых камер,Tiberius,+262,37818,453,0
post_113628,Анализируй это comma  или почему я каждый день опаздываю и получаю премию,mcconfig,+262,5994,295,0
post_108917,Взлом журнала Vogue или видео плеер за 119 руб,s2d,+262,10196,95,0
post_104035,Простейший взлом пароля,oe24,+262,9322,32,0
post_102153,Наш опыт участия в 10K Apart или как ужать 40 Кбайт кода в 10,whoozle,+262,4047,122,0
post_177159,Как я Quake в браузере делал,SiPlus,+261,81340,310,0
post_129863,Стоит ли быть «успешным»?,Legich,+261,7703,369,0
post_113246,История одного «нарушения» авторских прав. Часть 2,peter23,+261,3470,62,0
post_99716,Юзабилити кабинки туалета,Kottenator,+261,3272,57,0
post_84185,Как я покупал iPod touch на ebay comma  и как мне пришло не совсем то…,timsoid,+261,13589,355,0
post_82993,Почему сегодняшние нетбуки мне не нужны даже даром?,Novikov,+261,6355,34,0
post_213215,Теплый ламповый звук,oxothuk_uae,+260,96432,567,0
post_204342,Как мы пытаемся продать PVS-Studio в Google или очередные ошибки в Chromium,EvgeniyRyzhkov,+260,46977,51,0
post_195580,Смотрим на мир глазами рака-богомола: ближний инфракрасный диапазон,vvzvlad,+260,110239,247,0
post_169347,Теория относительности в картинках,Tazman,+260,191576,1020,1
post_147484,Отправляем заявление в Государственную Думу по законопроекту №89417-6,vodka_ru,+260,21165,75,0
post_90620,Почему Apple на самом деле не любит Flash comma  и при чём тут Android,Kiriyama,+260,3317,19,0
post_160621,Какого цвета Марс?,Zelenyikot,+259,115816,221,0
post_142836,ВКонтакте ддосит antigate.com,hormold,+259,33165,86,0
post_131840,Испанский суд признал пиратство безвредным,FakeFactFelis,+259,767,80,0
post_131175,Что делать comma  если вам грозят 38 млрд. (или меньше) за нарушение авторских прав,El_mario_che,+259,2626,341,0
post_120233,Красивый пример фишинга во «В Контакте»,aleksandrit,+259,7737,57,0
post_118534,Делаем микросхемы дома — шаги 0 и 1,BarsMonster,+259,21642,188,0
post_195454,Спасем крупнейшую медиатеку в рунете. Вся база rutracker у Вас на компьютере,J_o_k_e_R,+258,139260,686,0
post_181315,Аномальное голосование на сайте «Российская общественная инициатива» (РОИ),zapimir,+258,109706,79,0
post_196862,Процедурный генератор хрущёвок,BasmanovDaniil,+257,76942,306,0
post_190480,Как закрыть Интернет в России,amarao,+257,167167,129,0
post_127786,Вскрытие чипа Nvidia 8600M GT,Tiberius,+257,20251,168,0
post_110234,От песка до процессора,Boomburum,+257,103319,273,1
post_73127,Серьезный разговор о рулях,Boomburum,+257,9684,121,0
post_202184,Отладка самолета? Это очень просто!,curiousGeorge,+256,82324,241,0
post_132401,Дизайн будильника моей мечты,Adrior,+256,4520,283,0
post_207780,Лицензионное соглашение Облака Mail.Ru изменено,utkorose,+255,112298,54,0
post_113445,Почему я не верю в возможность улучшения сервиса в Сбербанке,forgotten,+255,2598,20,0
post_212997,Опасное развлечение: простой для повторения генератор высокого напряжения,kreosan,+254,150245,511,1
post_154413,Редактирование комментариев,habriel,+254,27486,13,0
post_148665,Радиоэлектронный фриланс,DIHALT,+254,31055,591,0
post_131020,Anonymous обрушили серверы с детской порнографией,jeston,+254,9610,45,0
post_96978,Жаргон программистов,Yakhnev,+254,9142,251,0
post_77623,Почему я убегу из школы,averkin,+254,2919,35,0
post_63732,На работу вовремя,voronove,+254,1367,28,0
post_207990,Часть 2. Сколько мегабит/с можно пропустить через зрительный нерв и какое разрешение у сетчатки? Немного теории,Meklon,+253,137340,827,0
post_129145,История одного «очень китайского» телефона,simbiod,+253,4442,28,0
post_127359,Некто решил удалить все упомининания о себе в сети. Что делать?,snusmumrik,+253,3064,55,0
post_58445,Антидизайн. Часть 2. Очевидные приемы,anti1869,+253,1348,156,0
post_210198,Математик взломал сайт знакомств и нашёл девушку мечты,alizar,+252,167808,258,0
post_128279,Happy 0b100000000 day!,mktums,+252,530,9,0
post_116560,FPV,maloii,+252,21058,325,0
post_195718,Как Сбербанк распространяет ваши личные данные,beskov,+251,136762,79,0
post_168421,Жизнь на плоскости Лобачевского,Mrrl,+251,54055,406,0
post_157969,Осторожно при покупке MacBook. Высокотехнологический способ мошенничества в оффлайне,rule,+251,166661,302,0
post_136283,Я не знаю Си,gribozavr,+251,10174,625,0
post_111956,Медиамагия: Настройка,vnizzz,+251,3291,493,0
post_62919,Взаимодействие между несколькими .bat comma  мультиплеер на .bat,Imp5,+251,3439,133,0
post_55143,Жизнь после фриланса,tanq,+251,2086,50,0
post_182290,Игровая партия длиной 12 лет… Кто больше?,Labutin,+250,121533,110,0
post_87827,Почтовый Дымовский. Попробуем достучаться до верхов?,hellt,+250,501,20,0
post_202010,Реализация мечты comma  или Радио 86РК — 25 лет спустя,curiousGeorge,+249,56462,253,0
post_158877,100 дней любопытства,Zelenyikot,+249,72121,146,0
post_146975,Вы все еще считаете comma  что воткнуть пару проводков в Arduino это DIY?,DIHALT,+249,17517,152,0
post_129533,Ubuntu в техническом вузе,JSK,+249,7311,181,0
post_127205,Вскрытие Pentium III comma  фотографии под микроскопом,alizar,+249,14542,98,0
post_111244,Про сжатие видео — Введение,acmer,+249,12487,248,0
post_199114,Удаленная работа — это не «фриланс»,eliah_lakhin,+248,90831,342,0
post_208060,Истинные причины блокировок сайтов. Исследование по открытым данным,Rassudov,+247,107091,130,0
post_206150,Вторая жизнь старых стрелочных индикаторов,ClusterM,+247,72944,501,0
post_191450,Взлет и падение начинающего фрикера,m0n5ter,+247,77471,116,0
post_181231,Нужны ли программисту бесплатные *люшки (версия 2023),AlexeyKovyazin,+247,93652,221,0
post_157377,Школьные поделки: Battlecruiser & DeathCraft,Athari,+247,66421,115,0
post_129173,Уводим чужие cookies c mail.ru,Flexo,+247,13977,95,0
post_123382,Курс по подготовке идиотов (цитаты из книги «Искусство оформления сайта»),0xy,+247,2363,82,0
post_89884,Как набраться смелости и открыть магазин,valkoivo,+247,35439,319,0
post_209746,Шпионские гаджеты от АНБ,Spetros,+246,258539,854,0
post_208048,Незаметные сложности ракетной техники,lozga,+246,100752,368,0
post_199338,Пара лайфхаков нашего интернет-магазина,Milfgard,+246,84388,300,0
post_117589,Как сохранить здоровье comma  работая за компьютером?,shiro,+246,13844,640,0
post_59570,10 приемов comma  разрушающих хрупкую красоту кода,Alik_Kirillovich,+246,5787,335,0
post_130305,Изменение часовых зон в России comma  Белоруссии и на Украине,roman_tik,+245,10817,233,0
post_108484,История одного «нарушения» авторских прав. Часть 1,peter23,+245,4088,125,0
post_112944,Рейтрейсер на JavaScript,ankh1989,+245,4790,269,0
post_70894,Привет из года 1988-го,sultee,+245,2230,17,0
post_216695,О патриотизме и реализме,Zelenyikot,+244,82023,158,0
post_196388,Как Mail.Ru Group убивает ММО-игры ААА-класса,myclarity,+244,138967,61,0
post_160793,Как работает стилус Galaxy Note,vvzvlad,+244,141944,271,1
post_113127,Забавляемся с хешами,NeverWalkAloner,+244,8430,192,0
post_112726,Просмотри видео на сканере штрихкодов,PatapSmile,+244,1722,36,0
post_204688,Крупнейшая афера с Bitcoin происходит прямо сейчас,ID120,+243,230663,224,0
post_146140,Нескучные интегралы,lany,+243,92902,464,0
post_133258,Реалистичные тени при помощи CSS3 без использования изображений,hautamaki,+243,51053,1308,0
post_132351,Do-Ra. Дозиметр в мобильном телефоне,PapaBubaDiop,+243,14493,80,0
post_131730,Маркерная доска своими руками,Taraba4,+243,33318,405,0
post_36564,Ты на Суперхабре comma  %username%!,Shoohurt,+243,195,6,0
post_171415,Бескомпромиссная мощь и реальная мобильность,ilyafd,+242,155870,541,0
post_170777,Как две недели?!,tangro,+242,97482,353,0
post_163869,Atari Portfolio — ноутбук Джона Коннора,BarsMonster,+242,134437,173,0
post_151381,Главную улику в деле уничтожил вирус,veveve,+242,152275,71,0
post_128911,Как я проходил собеседование в компанию Zynga,valyard,+242,7550,140,0
post_125735,Вокруг Яндекса за 59 дней,amarenkov,+242,10558,58,0
post_122296,ВКонтакте добавили публичные списки друзей,Anexroid,+242,5104,5,0
post_117008,Все о Лазерах,BarsMonster,+242,21384,291,0
post_91266,Взломали Gmail аккаунт,HighQuality,+242,7748,29,0
post_82762,Премиум-продукция? Только не с украинским сервисом!,Andrey_Rogovsky,+242,473,6,0
post_167093,Как начать летать comma  хоть на чем-то comma  самостоятельно,Genius_A,+241,99266,803,0
post_143974,Судья Алсуп умеет программировать и поучает адвоката Oracle,alizar,+241,13268,55,0
post_107446,Сказ о том comma  как Непалы клад искали,Lifz,+241,853,27,0
post_188992,Делаем микросхемы дома — часть 3,BarsMonster,+240,73662,331,0
post_114732,Простой тканевый фон за 5 секунд,s2d,+240,8156,856,0
post_104101,С Днем Программиста!,sidristij,+240,4313,7,0
post_179815,IntelliJ IDEA положена в основу новой Android Studio,beenom,+239,70842,153,0
post_120594,История создания Absolute Games,SLY_G,+239,6829,101,0
post_112953,Что нужно знать про арифметику с плавающей запятой,yruslan,+239,63672,908,0
post_108058,Если нет денег на AXIS comma  или управляемая вебкамера своими comma  в меру кривыми comma  руками,Gol,+239,11423,180,0
post_104202,Комментарии к статье CNews «Дыры в Mail.RU закрывают шантажом»,aig,+239,634,9,0
post_103397,Двадцать лет тюрьмы и миллион рублей штрафа за нелицензионный файл!…,Mithgol,+239,9279,45,0
post_55307,Продолжение топика о детях,eosunknown,+239,1226,27,0
post_213083,Переходы наличности и переходы на личности,ID120,+238,65915,686,0
post_198472,Как я был идеальным заказчиком,suchkovai,+238,69768,253,0
post_195720,Сварка оптических волокон. Часть 2: сварочные аппараты и скалыватели comma  механическое и сварное сращивание comma  отмеривание и укладка волокон,stalinets,+238,86220,748,1
post_154687,Подборка полезного для любителей Twitter Bootstrap,grokru,+238,173935,2973,0
post_198034,Опасна ли комета ISON?,Zelenyikot,+237,72323,115,0
post_167075,Применение процедурных генераторов в создании контента для real-time 3D приложений: Часть 1. Oil Rush,Unigine,+237,66676,593,0
post_131136,Умер Джон Маккарти,S2nek,+237,430,17,0
post_121903,Многопользовательский чат на BAT,k06a,+237,3436,200,0
post_95074,По две симки на одного,Boomburum,+237,3363,15,0
post_210044,Работа инженера — разные необычные истории,Nespashiy,+236,115302,211,0
post_198868,История ошибок: как мы построили и потеряли бизнес с оборотом 500 000 долларов в год,dimadubina,+236,157185,450,0
post_162567,Что в кратере тебе моём?,Zelenyikot,+236,48307,103,0
post_129664,Еще раз про IP-адреса comma  маски подсетей и вообще,salium,+236,196732,1256,0
post_124899,Chosen: сделай выпадающие списки более дружественными,alizar,+236,8170,775,0
post_113723,NoteSlate — просто блокнот и ничего лишнего. За $99,zavhozmk,+236,14423,229,0
post_102973,Разработчик — разрабатывай,Banzeg,+236,507,35,0
post_212343,На электричестве до Крыма,ivanovlev,+235,98365,239,0
post_198344,Новый СОРМ: слушать будут всех comma  Вымпелком против,shifttstas,+235,216593,169,0
post_189040,Ищите ошибки с помощью Google или «взлом» аккаунтов на badoo.com,AnnaZah,+235,93695,146,0
post_175717,Blind Deconvolution — автоматическое восстановление смазанных изображений,YUVladimir,+235,70767,691,0
