post_166009,R’ha — короткометражный анимационный фильм немецкого студента comma  открывший ему двери в Голливуд,last_level,+235,224169,333,0
post_141966,SkypeKit вылечен от жадности,zhovner,+235,10425,267,0
post_128280,Бесплатные книги,skim1776,+235,16634,1065,0
post_124261,Реверсия брендов,denissidak,+235,13497,77,0
post_120789,Переживания Эрика Шмидта,Shapelez,+235,320,42,0
post_90301,Стажировка в Google. Еще один взгляд,BlackStorkKCO,+235,4008,87,0
post_149237,Велосипеды на Javascript и jQuery,Sirian,+234,28548,1210,1
post_142989,ФАС разберется с нулевой пошлиной на iPad,veveve,+234,1003,9,0
post_139137,Как я стал уголовником,neskey,+234,7443,129,0
post_118902,Стандартный_тест_на_обработку_длинного_заголовка,NatalyaRukol,+234,704,20,0
post_116838,Оптимизируем процесс работы в консоли,Vorb,+234,3686,427,0
post_39266,Что на самом деле сделал Google,veter,+234,517,26,0
post_37364,А им не параллельно),master1981,+234,2401,26,0
post_166715,Никогда не отвлекай программиста!,alizar,+233,149047,855,0
post_116250,Тайм-менеджмент: эволюция,ThePretender,+233,3507,60,0
post_112237,Дыра на free-lance.ru,WildZero,+233,1459,24,0
post_110754,Как хакер издевался над преступником comma  своровавшим его ПК,alizar,+233,7865,99,0
post_94595,Используйте голову,akeepaki,+233,5598,274,0
post_78879,4700 слов правды,Boomburum,+233,1010,60,0
post_203094,Вечный торт: интервью с Денисом Крючковым comma  основателем Хабрахабра,XakepRU,+232,73689,224,0
post_139732,Как я делал самый популярный сайт о выборах,sharkzz,+232,6704,578,0
post_131008,Subtle Patterns: фоновые текстуры для вашего сайта,alizar,+232,24369,1350,0
post_130594,Неравномерно идущие часы,Ocelot,+232,9654,215,0
post_126170,Чего стесняемся comma  Google?,Antorix,+232,517,18,0
post_115700,Весенний апдейт comma  ч.1 «Торт»,deniskin,+232,624,25,0
post_113675,Чем порадовать любимую 14 февраля,Terehoff,+232,20253,228,0
post_104083,Как выглядит китайская клавиатура,ABBYYTeam,+232,182949,142,0
post_95438,Как на самом деле работает мозг,forgotten,+232,14560,319,0
post_92231,РАО снова жжот,nooze,+232,585,7,0
post_88737,Почему гику стоит переходить на Linux,ksi,+232,6369,132,0
post_183506,2084. Смерть копирайту,DenisVitman,+231,83429,106,0
post_180743,Смешивание текстур ландшафта,AndreyMI,+231,56527,822,1
post_168799,Василий Воропаев ушел с поста генерального директора Free-lance.ru,seweb,+231,49449,23,0
post_151934,Готовимся к наступлению Великого Русского Фаервола,shifttstas,+231,139633,542,0
post_142126,Ностальгия: роемся у «Танчиков» под капотом,horror_x,+231,11681,404,0
post_138291,Ещё +2Гб для вашего DropBox аккаунта. На сей раз comma  промо-акция DropBox и Three.com.hk,BannedMi,+231,5943,156,0
post_204008,Майнинг и как он работает: матчасть,Scratch,+230,134151,839,1
post_179543,Как уронить Windows шестью строчками кода,Jeka8,+230,187158,377,0
post_125018,DDoS-атака на Хабрахабр: post-mortem,ximaera,+230,47011,38,0
post_107631,Бесплатный VPN от Amazon,karohos,+230,42598,908,0
post_101396,Вопреки заявлениям Google comma  открытый Chromium тоже следит за вами,alexey_uzhva,+230,8872,21,0
post_87034,Жесткий диск умер — теперь работает как часы,Derailed,+230,30517,232,0
post_214529,Чемоданы айфонов и гопники в Бутово: как мы чуть не разорились на продукции Apple,ni404,+229,160064,223,0
post_186782,Эстафета из 50-ти квайнов,alizar,+229,94624,377,0
post_182302,Пост ненависти к модальным окнам,EugeneKudashev,+229,66138,50,0
post_157151,Adobe рассылает непонятные письма,adubovskoy,+229,102154,81,0
post_137276,Ближайшее будущее аккумуляторных батарей,polosatymyx,+229,25213,637,0
post_106702,Пишем свой драйвер под Linux,iznakurnozh,+229,15064,332,0
post_85984,Интерфейс программы Киви для Айфона,fearout,+229,1337,84,0
post_81998,iWish,andreyvo,+229,573,9,0
post_68273,Кевин Митник,jawbreaker,+229,14239,135,0
post_175885,Как я однажды преподавал программирование не как все,Labutin,+228,107435,220,0
post_156491,Контроллер «Virt2real» comma  или просто — Виртурилка,Gol,+228,162375,893,0
post_149447,Wi-Fi: неочевидные нюансы (на примере домашней сети),apcsb,+228,349505,2165,0
post_141524,Я и мои джойстики или как превратить хобби в работу (и наоборот),14TBAP_Kos,+228,32424,256,0
post_137210,Главе Крыма на открытии школы показали компьютерный класс с одними мониторами,zapimir,+228,3471,56,0
post_135344,Рисуем картинки с помощью кривой Гильберта,mkot,+228,9343,395,0
post_132032,PayPal или «Плати comma  дружок»,misha_kvakin,+228,10354,49,0
post_107607,Here be dragons: Управление памятью в Windows как оно есть [2/3],amirul,+228,9274,210,0
post_193578,Частный космос теперь и в России,Zelenyikot,+227,42807,116,0
post_185872,NES comma  реализация на FPGA,VaHG,+227,61122,234,0
post_184444,Венера или первые 60 kpx с другой планеты,Kamalesh,+227,83875,122,0
post_147148,Коаны о программировании,Nicolette,+227,18746,751,0
post_120159,Распознавание рукописных математических выражений,NeoNN,+227,2807,166,0
post_120079,Упрощаем регистрацию и вход на сайт,DezmASter,+227,6957,718,1
post_118113,Про вред молчания,Tomcat,+227,2810,181,0
post_108241,Вы наверное шутите comma  мистер Дал comma  или почему Node.js — это венец эволюции веб-серверов,inikulin,+227,5768,312,0
post_107161,The Case of the Intermittent Windows Freezes,amirul,+227,3594,209,0
post_75119,В поисках последней зарплаты comma  или как стать незаменимым и чем это чревато,artemlight,+227,2250,77,0
post_74267,Как я строил свой датацентр — часть вторая comma  строительная. Много картинок,piroman,+227,4170,57,0
post_50065,Тривиальные задачи по вёрстке,Vilz,+227,8421,621,0
post_49820,Зеркало для скачивания новых версий QIP.,pin,+227,604,5,0
post_201814,Внедрение корпоративного Linux в ПриватБанке,bodyakov,+226,82955,416,0
post_194736,Прекратите печатать!,ayakovlev,+226,109875,61,0
post_172263,Мысли об интерфейсе Facebook,digest,+226,107204,194,0
post_131791,Полочная акустика своими руками,nickurs,+226,60791,387,0
post_107160,«Социальная сеть»,phillennium,+226,649,22,0
post_89793,Цензура в новостях и блогах,leonidas,+226,373,5,0
post_65100,Hacking on Rails,tokza,+226,973,19,0
post_184662,Радиоастрон — телескоп будущего,Zelenyikot,+225,59357,129,0
post_161205,Ликбез по типизации в языках программирования,Fai,+225,86020,1127,0
post_123122,Раздача слонов или инвайты на Google+,MetallicAt,+225,685,17,0
post_118836,Компьютер-флэшка за $25,alizar,+225,7548,155,0
post_115126,Очередная регистрация ООО или жестокая война с налоговой,Rchee,+225,4458,165,0
post_104292,Как же стать злым?,artyfarty,+225,2162,55,0
post_72910,«Demonoid для нас – обычный клиент»: интервью с украинским провайдером пиратского трекера,pazzive,+225,678,20,0
post_57772,Идеальный NAS — Synology DS209+,Boomburum,+225,23707,132,0
post_19904,Пасхальные яйца в мультиках Pixar,Alaska,+225,3421,60,0
post_186314,Как легко потерять домен с миллионной посещаемостью,prostopleer,+224,160502,86,0
post_161401,Взгляд изнутри: RFID и другие метки,Tiberius,+224,71700,370,0
post_157305,Черногория — не Таиланд,Begetan,+224,183732,480,0
post_156761,К чёрту такие инновации!,javascript,+224,138321,38,0
post_139940,Защищаем сайт от атак на примере ХабраХабра,kafeman,+224,3826,678,0
post_136084,Демотивация по полной программе или почему я жду конца света?,Dehumanizer,+224,4372,786,0
post_100245,«Русский щит Северо-Запад» нарушает авторские права,KrasivayaSvo,+224,2210,12,0
post_89319,Как сделать хорошую фотографию глянцевого телефона,evg8000,+224,3561,160,0
post_81971,Перепрошивка USB модема ZTE MF627 comma  залоченного под МТС comma  для свободной работы с SIM-картами сторонних операторов + учим его звонить и принимать звонки & разлочка с помощью Unlock кода модемов Huawei,Mypuk,+224,100782,312,0
post_68143,Моя монетизация Твиттера,vikfed,+224,1664,57,0
post_65801,Полная чаша: работа дома comma  с женой и маленьким ребенком,dkuznetsov,+224,7777,59,0
post_40725,"Одноклассники" нарушают авторское право?,WoZ,+224,1299,18,0
post_198092,Как мы наживаемся на авторах — исповедь издателя,AndrewPokora,+223,69713,244,0
post_190912,Электромобиль Tesla S сломал оборудование для проведения краш-тестов,alizar,+223,240026,174,0
post_188826,Зачем МГТС двигает PON,telefonist,+223,77103,106,0
post_186160,Сражаясь с анонимностью,d00kie,+223,98652,452,0
post_169579,Мультиварка — умная кастрюля или «не доведенный до ума» гаджет,vikky13,+223,544091,1270,0
post_116909,Об английском и не только — как «вжиться» в иностранный язык,vkzm,+223,1787,162,0
post_105002,Опубликован весь архив Computer Science клуб при ПОМИ РАН,yasha_somov,+223,1250,491,0
post_101323,Прохлаждаемся: кондиционер своими руками,netAn,+223,30401,101,0
post_92886,О неадекватности отбора программистов,torbasow,+223,4210,56,0
post_50280,Боремся с Radarix.com. Часть первая.,gta4kv,+223,1099,16,0
post_48543,Обзор клавиатуры Optimus Maximus,Boomburum,+223,17235,21,0
post_48518,Делаем Liquid Resize своими руками,GMM,+223,3812,292,0
post_197514,Чиновники отклонили петицию об отмене «антипиратского» закона,Osaka,+222,99418,49,0
post_190478,Разработчик сообщил о баге в Facebook на страницу Цукерберга,aleksandrit,+222,124429,35,0
post_180163,Skype — Да comma  мы читаем все comma  что Вы пишете,GAS_85,+222,165778,103,0
post_163139,Six Towers. История успеха?,PapaBubaDiop,+222,70326,361,0
post_148102,Так что же случилось со Сбербанком?,hard_sign,+222,10992,71,0
post_120192,JavaScript F.A.Q: Часть 1,azproduction,+222,22768,840,0
post_101440,Как не стать спамером со своей уютной рассылочкой,Joshua,+222,11842,655,0
post_89439,Советы программисту-дизайнеру интерфейсов,apple_fan,+222,2604,286,0
post_95004,Как прокачивать мозг,Cord,+222,29541,734,0
post_210042,«Всем привет в этом чате» — мой любимый ответ на массовую рассылку,Milfgard,+221,91403,151,0
post_153995,В какой день лучше всего публиковать пост на Хабре?,Silf,+221,34230,194,0
post_140725,Android. Обзор боевых приложений,Asperka,+221,154400,2030,0
post_127024,Стив Джобс покинул должность CEO Apple,aleksandrit,+221,607,9,0
post_108156,«Намертво прибитая к ядру» графическая подсистема,amirul,+221,2469,135,0
post_103389,Летний апдейт,deniskin,+221,514,22,0
post_194254,Почему Curiosity на Марсе comma  а не в Неваде,Zelenyikot,+220,95990,88,0
post_193950,Замечательное выступление настоящего программиста,seventh,+220,123612,702,0
post_186978,Радиоастрон рвет шаблоны,Zelenyikot,+220,66542,119,0
post_156579,Собираем и заставляем бегать бюджетного гексапода,poconoco,+220,92810,666,0
post_143682,Тесла-пушка,Ocelot,+220,24669,423,0
post_136949,Сергей Супонев — вспомним,Makaveli,+220,4889,74,0
post_104777,Achtung: DDoS,Pas,+220,569,18,0
post_179333,Разработчик ядра Windows NT объяснил причины низкой производительности ОС,alizar,+219,135165,192,0
post_171199,Водитель Curiosity продолжает отвечать на вопросы Хабра,Singerofthefall,+219,45243,141,0
post_131868,Владельцам Wi-Fi оборудования вменяют обязанность ГЛОНАССирования,Nikolaich,+219,1783,60,0
post_53048,«Ошибки в ДНК» или как неправильный дизайн может приводить к миллионным убыткам,khim,+219,749,37,0
post_206936,Как мы запускали космический телескоп,Zelenyikot,+218,40651,73,0
post_150958,Ностальгия: как работают «сохранения на бумажке»,horror_x,+218,73485,245,0
post_149349,Про jQuery и велосипеды — мое дополнение,LionMuzzle,+218,21716,1253,0
post_145045,Статистика Хабрахабра,vyacheslav_ka,+218,42752,165,0
post_114937,12 способов не накосячить со вспышкой,Milfgard,+218,62883,588,0
post_102537,Виджет для Opera — OpenBoobs Reader,CaptainQuazar,+218,3008,77,0
post_98370,Facebook vs Вконтакте comma  Афины vs Спарты comma  США vs СССР comma  либерализм vs вертикали власти,art_of_press,+218,1252,60,0
post_36692,Вся неправда про Суперхабр,juks,+218,6430,104,0
post_157917,Как «открыть» микросхему и что у неё внутри?,BarsMonster,+217,91534,364,0
post_152995,Что нужно делать смолоду или как стать богатым айтишником,buddhaslav,+217,282247,2017,1
post_139399,Егор comma  прекрати взламывать Github!,alizar,+217,16098,54,0
post_119104,Angry Birds стали веб-приложением,phillennium,+217,1313,67,0
post_102614,Станция УВБ-76 подала четвёртый сигнал за 30 лет,alizar,+217,40905,116,0
post_99609,#Дождь в Trending Topics,MrMmka,+217,284,13,0
post_175025,Время вспять…,Glowfall,+216,60693,287,0
post_172553,У вас много денег? Перестаньте быть снобами,Mnemonik,+216,87845,127,0
post_155371,Как работает микроэлектронное производство и что нам стоит дом построить?,BarsMonster,+216,84794,465,0
post_132828,Plugin Detector — каталог и рейтинг плагинов jQuery,petrovnn,+216,2309,613,0
post_126164,Русские православные альтернативы отсталому Скайпу,andruhov,+216,4319,23,0
post_124347,Офис компании «ВКонтакте»,Boomburum,+216,55978,112,0
post_119743,Инфопункт comma  или интересная инициатива властей Петербурга,Alwake,+216,704,24,0
post_117695,Паять просто (комикс),atarity,+216,7976,410,0
post_99797,Handy Light. Как подросток обхитрил Apple,smartov,+216,1986,10,0
post_83611,История одного неудачного взлома,Kamael,+216,2252,20,0
post_60399,Дело Джо Тененбаума,Shapelez,+216,462,16,0
post_211444,Rosetta — самая интересная космическая миссия 2014 года,Zelenyikot,+215,64513,139,0
post_210086,Сервисы экспресс-доставки прекратили доставку посылок в Россию,Roschen,+215,125049,92,0
post_185154,Генерация музыки в реальном времени,Armaxis,+215,75577,513,0
post_144686,Разработка ПО авионики,wwakabobik,+215,26669,394,0
post_133780,Пишем примитивный и никому не нужный компилятор,zserge,+215,20467,586,0
post_97646,ФБР не смогло взломать зашифрованный диск (сдались через год брутфорса),alizar,+215,8664,47,0
post_200640,Астрофотография в каждый дом,BarsMonster,+214,70601,576,0
post_151280,Возможно comma  вы идете не туда,alexrublev,+214,104082,710,0
post_113264,Загрузочный телефон,Recluse,+214,5358,212,0
post_99324,Как собрать Кубик Рубика 5х5х5 (часть 1),Alex_MIPT,+214,11614,170,0
post_62894,Пост тотального превосходства маков над другими унылыми компьютерами,kortunov,+214,442,18,0
post_186894,Официальная позиция Ростелекома по поводу блокировки сайтов,ElGatoAhuecado,+213,97755,28,0
post_134784,Работа с памятью (и всё же она есть),evgenyl,+213,17569,600,0
post_75649,Свой сапер на своих батниках,nsinreal,+213,2464,66,0
post_39616,Дети,eosunknown,+213,1389,27,0
post_197634,«Хабрахабр» запускает программу поддержки стартапов,deniskin,+212,62487,342,0
post_193600,Что дети думают о программистах и программировании,holymay,+212,52082,113,0
post_168787,Простой ответ на сложный вопрос: Почему работа не идёт?,alexrublev,+212,94020,555,0
post_143718,Ещё раз о невероятной лояльности службы поддержки Logitech,Pagefest,+212,18602,140,0
post_141022,Исходники Prince of Persia нашлись спустя 23 года,alizar,+212,5653,79,0
post_123600,Нигерийские мошенники на Molotok.ru. Одна из схем мошенничества,pnick,+212,16276,26,0
post_119936,Австралийские роботы сами придумали себе язык,IkarDedalovich,+212,1196,67,0
post_109623,Вот так надо продавать свой старенький Мак,PeterQ,+212,3003,58,0
post_108464,ИБ на Новосибирском Заводе ХимКонцентратов (производство ядерного топлива),awarebeaver,+212,1855,50,0
post_84350,Дешевый способ добраться до Гавайев,mnarinsky,+212,2250,18,0
post_80721,Шпаргалка по расшифровке имен видеофайлов,Sirob039,+212,6857,407,0
post_210690,Крупнейшая битва в истории EVE Online: уничтожено кораблей на $200 000,alizar,+211,310056,161,0
post_200612,Как писались игры на Dendy,PerlPower,+211,107365,317,0
post_167581,3000 кораблей схлестнулись в бою в EVE Online,madmaxcorp,+211,269555,211,0
post_141922,Искусство публичных выступлений,philipto,+211,17055,1160,0
post_122524,Google AdSense или лес рубят — щепки летят,veveve,+211,7092,27,0
post_113516,Спасибо!,Sberbank,+211,24303,15,0
post_113226,Стильный фон за 5 секунд,shaida,+211,2010,302,0
post_94548,Прекратите спрашивать с меня подтверждение,G_Z,+211,1368,84,0
post_206100,3G-интернет на 33 км,realscorp,+210,100095,428,0
post_202460,Люди с кодопрошлым или закат программистов,lucius,+210,146027,249,0
post_186424,Вертолёт на педалях продержался в воздухе 64 секунды,alizar,+210,126271,107,0
post_170497,Дата-майнинг 10 000 актёров порно,alizar,+210,169602,235,0
post_149090,Хочешь быть iOS разработчиком? Будь им!,jarvis,+210,118826,2615,1
post_135776,Как Google тестирует ПО,skid,+210,11242,806,0
post_127391,Почему фрилансер и заказчик часто считают друг друга идиотами,Milfgard,+210,75613,374,0
post_115092,Как вернуть качественный звук в Windows 7 — побитовый вывод comma  аппаратные эффекты (EAX и пр.),Audiophile,+210,72508,398,0
post_197314,Очередная программная закладка в роутерах D-Link,Xlab,+209,94346,397,0
post_196232,Роскомнадзор начал блокировать сайты за тексты с Детской Порнографией™,shifttstas,+209,138837,48,0
post_152747,Создаем рекурсивные ярлыки в Windows,IGHOR,+209,80405,670,0
post_118475,Как стать системным администратором — пособие для начинающих (часть 1),amarao,+209,123487,767,0
post_116214,SSH-туннель домой без необходимости оставлять включённым домашний ПК,zilia,+209,42904,848,0
post_113376,Прощай comma  салфетки comma  или как избавиться от глянца ноутбука,cosharika,+209,10522,258,0
post_109731,Умри comma  но заплати долг Мегафону: о том ли спор?,gegory,+209,718,5,0
post_97301,(обновлено) Уровень приёма сигнала на iPhone 4 падает в разы comma  если взять телефон в руку,xqz_me,+209,3217,9,0
post_63819,Как стать разносчиком спама ВКонтакте из-за любопытства,xanf,+209,5545,34,0
post_38208,jQuery для начинающих,AntonShevchuk,+209,39578,990,0
post_171015,Пример — часы на СSS3 без изображений и JavaScript,rassadin,+208,62867,685,0
post_144216,Налог на сайт,veveve,+208,4949,42,0
post_128323,Яндекс начинает борьбу с переоптимизированными текстами,adamant,+208,418,13,0
post_119659,Разработка браузерной стратегии,Armin,+208,6402,239,0
post_103635,Внутри MP3. А как оно всё устроено?,negasus,+208,11275,349,0
post_78635,Твиттер взломан иранскими хакерами,Bis,+208,393,8,0
post_77291,Ни х** нету или секреты перевода на русский язык facebook,Squirrel,+208,580,15,0
post_217717,Я позвонил comma  чтобы потратить ваше время,mclander,+207,77663,82,0
post_191780,Новая Зеландия запретила софтверные патенты,alizar,+207,48755,66,0
post_185638,Основная особенность наших разработчиков,Yfka,+207,108670,400,0
post_117315,Вышел Nginx 1.0,zkv,+207,213,38,0
post_112165,История одного вскрытия: реверс-инжиниринг Java ME трояна,den_lesnov,+207,2359,62,0
post_67179,Сверхплавное передвижение объектов,dmitrek,+207,2294,212,0
post_66209,QIP: точки над «i»,Skiminok,+207,2798,79,0
post_183748,Чёрные списки: как мы судились с Роспотребнадзором (часть 2),edwardspec,+206,46083,50,0
post_147927,Я не знаю ООП,ffriend,+206,69272,918,0
post_138749,Техническое задание на сайт,stg34,+206,122181,1979,0
