id, title, author, score, views, favors, isTutorial
post_217645,Как Минковский во Flappy Bird играл,s3r4f1m,+350,74467,354,0
post_217545,Как правильно лгать с помощью статистики,varagian,+306,81996,736,0
post_217775,Факты о космосе comma  в которые трудно поверить,Zelenyikot,+297,124298,219,0
post_217717,Я позвонил comma  чтобы потратить ваше время,mclander,+207,77663,82,0
post_217541,Стимпанк-кофейня в Южной Африке,Milfgard,+144,49514,163,0
post_217581,Колесо-буксир сэкономит пассажирским авиакомпаниям миллионы долларов,ilya42,+113,58786,38,0
post_217985,Автоматическая кормушка для птиц,ivan-vovanych,+111,35679,118,0
post_215905,Signed Distance Field или как сделать из растра вектор,RPG,+111,24195,330,0
post_217679,Почему компании отказываются от лучших сотрудников?,Chebanov,+110,62569,205,0
post_217585,Сети для самых маленьких. Часть девятая. Мультикаст,eucariot,+104,28473,884,1
post_217921,Занимательная археология. Или PVS-Studio проверяет Microsoft Word 1.1a,Andrey2008,+98,38059,25,0
post_218051,Google Chrome — убираем рутину с помощью кастомного поиска,lalaki,+96,31323,760,0
post_217893,Микрокомпьютер Module MB 77.07 — русский ответ Raspberry Pi,Promwad,+93,55104,185,0
post_218039,Canonical закрывает сервис Ubuntu One,FRAGIL3,+92,34554,16,0
post_217699,Яндекс.Почта позволит отписываться от рассылок,bgarkushin,+92,14777,25,0
post_217671,Загадочное объявление от IBM,untech,+85,97265,143,0
post_217981,Яндекс и Высшая школа экономики открывают факультет Computer Science,Zalina,+84,23407,99,0
post_217693,Детектор троллинга: как мы повышали продуктивность с помощью речевого анализатора,TeamMRG,+81,32716,40,0
post_217719,Управленческие инструменты: Формула нужды или Каким образом нас отжимают?,eagleson,+77,35631,366,0
post_217665,Национальная платёжная система и ширина лошадиной задницы,faxenoff,+75,44278,117,0
post_217453,Новый дизайн процессоров Intel — сделано в России!,vikky13,+71,60856,26,0
post_217617,Тестирование «быстрой MongoDB» – TokuMX в условиях comma  близких к реальности,umputun,+71,11404,55,0
post_214561,Как мы продали первый тираж книги 5000 экз. за два месяца,Bredun,+69,21097,53,0
post_217739,Традиционный пост к Первому апреля,xandr0s,+68,78476,97,0
post_217557,Математикам доверяй comma  но проверяй,Andrey2008,+68,30776,68,0
post_217959,Загадочная игра от IBM,olestu,+67,48694,39,0
post_217735,SSD: подвиды и перспективы,ETegro_Technologies,+67,48960,150,0
post_217601,Sono: активная система шумоподавления для окон,ilya42,+67,28835,73,0
post_217525,Сравнительное тестирование SDHC карт памяти стандарта UHS-I объемом 32 ГБ,Samendk,+63,27309,196,0
post_218013,Что можно сделать с ITEAD IBOX. Часть 1,djmorgan,+57,26756,45,0
post_217873,Легко ли человеку с инвалидностью найти работу в IT,djika,+56,20707,37,0
post_217637,Сертификация товаров в РФ или 9 кругов ада,MaxVed,+56,26867,94,0
post_217819,Разминка для шеи в терминале,hardex,+55,20767,39,0
post_216437,Автономный квадрокоптер с нуля: PID и грабли,alexac,+52,23463,255,0
post_218023,Кометный посадочный модуль «Фила» успешно проснулся на борту зонда «Розетта»,marks,+52,13720,20,0
post_217787,Обзор новой линейки коммутаторов Cisco Fatalyst,asch,+52,22858,25,0
post_216697,Лёгкий способ писать iOS приложения на вебе,mobilz,+52,30442,562,0
post_217501,Несколько интересностей и полезностей для веб-разработчика #14,ilusha_sergeevich,+52,16897,352,0
post_217925,[видео] 8 способов противостояния формуле нужды,eagleson,+51,19476,294,0
post_217349,Следующее поколение процессоров Intel будет предлагаться как услуга,saul,+51,57870,28,0
post_217611,Remote по-русски. Новая книга от 37signals,HotWaterMusic,+51,16888,202,0
post_217891,Соединяем эллиптический тренажер и pygame,Velese,+50,13085,52,0
post_217839,Поиск в пространстве состояний,ABBYYTeam,+49,6585,90,0
post_217765,Панель управления умным домом. iPhone в стене,aivs,+47,16801,290,0
post_217575,Demonoid снова с нами,siomi,+47,29072,46,0
post_217647,while(true){ Apple подала новый иск к Samsung на $2 млрд },Yurevich1,+46,28422,12,0
post_218059,Интервью с Джеффри Рихтером на конференции Microsoft SWIT 2014,bohdannanovskyi,+44,8157,24,0
post_217865,Производственный юмор: запросы от пользователей Acronis True Image,gaidar,+44,39140,14,0
post_217615,Лекториум запускает направление MOOC,yasha_somov,+44,6142,94,0
post_217215,«Что такое доказательство?»: взгляд из теоретической информатики,dmitrits,+43,9113,158,0
post_217979,Google теперь позволяет настроить панель сервисов,PavelPV,+42,12827,25,0
post_217503,Интересно и познавательно: управляемая посадка на ПТК НП,lozga,+42,9232,86,1
post_217827,Павел Дуров покинул пост генерального директора Вконтакте. Нет comma  это не шутка,Bakuutin,+41,39139,14,0
post_217203,Properties framework для Qt,lexxmark,+41,5790,119,0
post_217409,ХабраFAQ про поиск работы в интернете,djika,+41,17687,109,0
post_217785,Возвращение героя: Nokia 3310,ivansychev,+40,69155,41,0
post_217727,Starshade — поиск обитаемых планет,FilegiverCom,+38,15780,42,0
post_217691,Шаринг кода между платформами WP7 comma  WP8 comma  Win8. Основы,Atreides07,+37,5296,71,0
post_217595,Аннотации в Java comma  часть I,IvanGolovach,+37,10237,276,0
post_217801,YAWNDB — time series база данных,p_a,+36,5363,48,0
post_217675,Обзор паяльной станции BAKU 898D,lionsitroen,+36,20189,125,0
post_217631,Python-digest #20. Новости comma  интересные проекты comma  статьи и интервью [23 марта 2014 — 30 марта 2014],alrusdi,+35,5549,79,0
post_217731,Массовый релиз продуктов .NET,beenom,+34,11389,27,0
post_217715,Порталы нежити в Android,d1g1,+34,18725,95,0
post_217751,Яндекс почистил DNS view для AAAA-записей,ivlad,+34,9382,13,0
post_217437,Свой http-сервер менее чем в 40 строк кода на libevent и C++11,NYM,+34,17946,196,1
post_217661,Технологии научной фантастики: варп (Звёздный путь),Verglii,+33,29350,100,0
post_217883,hlpme.ru — сервис безвозмездных услуг,karaboz,+32,14085,61,0
post_217803,Людям нужна не дрель comma  а картина на стене,ArtyV,+32,18309,114,0
post_217599,Разбираем IBOX comma  еще один ARM-мини-ПК,webself,+32,33246,81,0
post_217877,Что ждет IntelliJ IDEA впереди?,beenom,+31,13684,27,0
post_217609,Немецкие учёные измерили массу электрона в 13 раз точнее comma  чем раньше,ilya42,+31,16852,17,0
post_217951,Компания Festo создала новый тип ветрогенератора,marks,+29,32246,51,0
post_217745,В Гарварде изобрели эластичный прозрачный громкоговоритель из гидрогеля,ilya42,+29,10776,26,0
post_217419,Национальная платёжная система: что это значит для вас comma  и когда конкретно паниковать,plutsik,+29,27658,81,0
post_217999,ПО для монтажа и сборки нелинейного интерактивного кино,aureliano_b,+26,11047,126,0
post_217779,Эмуляция нажатия мультимедийных клавиш в Windows comma  Linux и Mac OS X,snasoft,+26,6024,100,0
post_217773,LUA в nginx: лапшакод в стиле inline php,AterCattus,+26,5710,61,0
post_217571,3DO или потерянное звено,Just_Wah,+26,15522,27,0
post_217431,Ежемесячный дайджест интересных IT-проектов на Kickstarter №2,Nikita_Rogatnev,+26,24909,37,0
post_217949,Тестирование конвертеров шрифтов,Softlink,+25,3595,151,0
post_217843,Обзор Motorola Defy Pro – защищенного ретро-смартфона с QWERTY-клавиатурой,alexeystar,+25,15188,21,0
post_217015,История Samsung Electronics: От сушеной рыбы до высоких технологий,ivansychev,+24,17517,45,0
post_217763,Персональный оазис на офисном столе,ilya42,+24,13826,77,0
post_217619,Cubietruck & Raspberry Pi & Arduino,ntfs1984,+24,13603,140,0
post_216789,Дайджест KolibriOS #3: начало весны,Punk_Joker,+23,3890,12,0
post_215269,История игровых приставок в рекламе. Часть 3,ivansychev,+23,12760,52,0
post_218035,Опрос: каким должно быть дополнительное образование?,avsmal,+22,9088,52,0
post_217683,Занятные факты о потерях данных,Ramon,+22,10172,39,0
post_215961,Обзор роботов для настольных игр,ivansychev,+22,7043,29,0
post_217317,Алгоритмы обработки видео на процессоре TI DM368,vadshe,+22,6742,74,0
post_217809,Исключение — твой друг,AllexIn,+21,12195,68,0
post_217653,Moai SDK 1.5 — кроссплатформенный 2д игровой движок,Vavius,+21,6622,93,0
post_217923,Социальные сети в России сегодня: цифры comma  тренды comma  прогнозы,CvetKomm,+20,9771,45,0
post_217743,Математика для тестировщиков,Polazhenko,+20,8311,177,1
post_217725,Вышел COLT 2.0 с поддержкой Angular.js comma  node-webkit,codeorchestra,+20,3191,33,0
post_217625,Первый взгляд на прототип Yotaphone 2,vvzvlad,+20,19432,20,0
post_217911,Контролируем переполнение ячейки таблицы с помощью max-width,CyberAP,+19,6837,204,1
post_212701,NanoMMO на Go и Canvas [Сервер],TatriX,+19,18473,132,0
post_217963,Анализ и визуализация реальных табличных данных в R,avidclam,+18,2671,77,1
post_217519,Активация многопользовательского режима на вашем смартфоне с Android 4,sergeevms,+18,10391,84,0
post_217855,Стандарт WAI-ARIA 1.0 получил официальный статус рекомендованного W3C: чего ожидать в будущем и куда бежать уже сейчас?,Tseikovets,+17,2938,20,0
post_217523,Перевод legacy-проекта на Dependency Injection. Путь Ситха,seregamorph,+17,6427,91,1
post_217863,Habrachat или использование ARM сервера,stalkerg,+16,11961,52,0
post_217771,Как минимизировать постановку для контент-сайта,sobakapavlova,+16,3705,86,0
post_216545,Intel INDE Media Pack,Terror,+16,1170,24,0
post_217861,Расписание вузов: сделали «Будильник» перед парами и онлайн-форму для заполнения расписания,vuzarium,+15,3895,20,0
post_217909,Простые 2D гоночки в космосе под Tizen или Как выиграть хакатон Tizen Association,nikolayz,+15,5572,45,0
post_217869,Дружим Git с Putty,Borz,+15,4351,142,1
post_217791,Обновляемый многопользовательский макрос,SarumSv,+15,2819,41,0
post_217913,Windows-планшет Dell Venue 8 Pro comma  впечатления от использования,aik,+14,15292,32,0
post_217823,Самое бесполезное в мире расширение для Opera,pepelsbey,+14,21342,10,0
post_217687,YotaPhone Idea Camp: вместе мы — сила!,YotaDevices,+14,1966,,0
post_217075,Вариант эргономичной компьютерной клавиатуры и проблема «упаковки» нескольких «функциональных зон» стандартной клавиатуры в одну,Steve_Key,+13,6827,45,0
post_218003,Как обрабатывать терабайты данных в 1000 потоков на PHP — Hadoop/MapReduce,AlexSerbul,+13,9902,195,0
post_217953,China UnionPay заменит россиянам MasterCard и Visa?,opoli,+13,20017,10,0
post_217213,TYPO3 CMS кластер в облаке Jelastic,jelastic,+13,2692,67,0
post_217867,Конференция Build 2014 уже завтра!,kichik,+13,3785,13,0
post_217463,От флеша до appstore comma  полный цикл,Elegar,+13,6978,98,1
post_217789,Голосовое управление медиацентром,sergemoose,+13,7282,84,0
post_217657,Контроллер Wi-Fi точек доступа на Mikrotik,GeXoGeN,+13,7475,162,1
post_217641,Новый хаб «Chrome Extensions»,spmbt,+13,5384,48,0
post_218011,Впечатления о курсе Human-Computer Interaction на Coursera,sobakapavlova,+12,4951,37,0
post_217095,Пользователь смартфона comma  знай свою скорость печати!,kotlyarovsa,+12,6773,28,0
post_217849,Занимательная статистика от HFLabs,AlexGechis,+12,5572,14,0
post_217837,Уход Павла Дурова с поста гендиректора ВКонтакте: не первоапрельская шутка comma  100%,sinodov,+12,29744,16,0
post_217815,Как сделать самый крутой сайт comma  чтобы все конкуренты завидовали,htdt,+12,18279,115,0
post_217635,WebJob в Microsoft Azure,SychevIgor,+12,1291,20,0
post_217941,Как небольшой студии/агентству получить свой стенд на РИФе?,Terekhov,+11,1274,11,0
post_218019,Пара слов о Epson Moverio BT-200,epsonic,+9,3121,3,0
post_217737,Чего я хочу от инструментов разработки требований. Затычки comma  костыли и грабли СУТ,Polazhenko,+9,2509,64,0
post_217685,Обзор мультифакторной аутентификации в облаке Microsoft Azure,ahriman,+9,1202,13,0
post_217967,Конвертация RAID 10 из 4-х дисков в RAID 6 из 8-ми дисков на серверах HP Proliant,bi4o4ek,+7,4681,52,0
post_217807,Microsoft завершает поддержку Windows XP,esetnod32,+7,14369,5,0
post_215625,Epson: хабрадебют,epsonic,+7,2799,,0
post_218037,Cложности создания и издательства первого Android приложения,pansik,+6,12351,104,0
post_217983,Резервное копирование на удаленный сервер,1it,+6,9946,205,0
post_217269,JavaFX и AnimationTimer,RomeoGolf,+6,2087,15,0
post_217945,Книга «Объектно-ориентированное мышление»,ph_piter,+6,9561,46,0
post_217897,Вышла финальная версия Microsoft SQL Server 2014,Ernado,+6,6794,7,0
post_217561,Как web-страницу легко превратить в PDF?,ruslanys,+6,11471,113,1
post_217669,TACACS+ на Linux с аутентификацией через Active Directory,Kiseloff,+6,2055,29,0
post_217587,Портативные аккумуляторы серии LZ от iconBIT,andrey_snegovik,+6,7086,15,0
post_215809,Facebook vs. Google: битва технологических гигантов переместилась в небо,Murashova,+6,11290,3,0
post_218053,Симметрия чисел,okho1,+5,5621,37,0
post_217997,Книга Learn BlackBerry 10 App Development доступна для бесплатной загрузки,Akuji_bwn,+5,2143,19,0
post_217969,Загрузка исторических данных в SAP с помощью LSMW — пишем «макрос»,AntonVolkov,+5,1014,9,1
post_217859,Министерство связи РБ запустило в тестовом режиме ресурс для оценки качества услуг передачи данных. «Спидтесты» больше не нужны,white_crow,+5,12663,13,0
post_217857,ChickenBoard — новая идея для эргономичной клавиатуры,Nylithius,+5,10555,14,0
post_217851,Ciklum приглашает всех в Харьков 12 апреля на .NET Saturday,ciklum_dev,+5,1988,1,0
post_217833,Неожиданный прогресс Robomow — чистим бассейн comma  пылесосим и косим одним устройством,Man197,+5,2924,7,0
post_217749,Ngbuild. Собираем Angular приложение без лишних слов,galkinrost,+5,2328,42,1
post_217753,Основы работы со StackExchange API,asaskevich,+5,1523,20,0
post_217559,Полезные материалы для мобильного разработчика #46 (24-30 марта),RoboForm,+5,4519,25,0
post_218031,SAP ABAP: Crossing Checkpoint Charlie in a SAAB (перевод статьи c scn.sap.com),blick,+4,1519,11,1
post_217799,Как уменьшить издержки на виртуальный центр обработки данных с помощью флэш-накопителя USB,ThePixel,+4,8056,33,0
post_217695,Современные тенденции развития DDoS-атак и защита от них с помощью DefencePro Radware,sashaboyko,+4,6311,34,0
post_217659,Прогноз количества лайков у поста. SNA Hackathon 2014,DMwarden,+4,794,2,0
post_217639,Работа с SQL Server в сценариях гибридного Облака. Часть 2,alexejs,+4,989,14,0
post_217297,Репортаж с InterSystems Global Summit 2014,DAiMor,+4,409,3,0
post_217993,Ждем летних вебинаров от Алексея Кибкало,VitalySt,+3,3514,4,0
post_217915,Антивирус на сервере — быть или не быть?,bugaga0112358,+3,12145,17,0
post_217889,Видеообзор планшета Samsung Galaxy Tab Pro 10.1,eNotik,+3,2786,,0
post_217845,В туалет — «по смартфону»,webself,+3,7711,13,0
post_217629,VPS как анонимный прокси и не только…,bogdanov_go,+3,6653,52,0
post_217643,Huawei Tecal RH2288H V2 — первые впечатления,Advanserv,+3,3832,9,0
post_216475,REST клиент и сервер на Yii,ischerbin,+3,2419,54,0
post_217667,Принципы успешного внедрения IDM. Бизнес-кейсы,TrustVerse,+3,1620,15,0
post_217649,Передача табличных данных из хранимой процедуры,Ant00,+3,2562,22,0
post_217965,Восемь приемов comma  которые маркетологи могут позаимствовать у Agile-программистов,Irina_Ua,+2,3210,11,0
post_217709,Рунет в картинках XIV. «Ростовщики без ничего святого» или самый быстрорастущий сегмент российского финансового рынка,PayOnline,+2,10953,22,0
post_218007,Особенности мобильных приложений на платформе iOS comma  использующих логин и пароль клиентов для доступа к платному контенту,Daniil_Chernov,+1,1927,11,0
post_217879,Мировой релиз Boom Beach comma  война платформ и тренды GDC — главные мобильные новости за неделю,kamagames,+1,7852,12,0
post_217881,Видеообзор ноутбука Lenovo IdeaPad G510,eNotik,+1,1166,1,0
post_217841,Project manager + BPM = оптимальное решение?,seregei-azarov,+1,3234,33,0
post_217651,Как перейти от Цели подразделения техподдержки к показателям comma  понятным сотрудникам,GreyBear,+1,1400,16,0
post_217729,FundingTo – сбор средств по вашим правилам,Irina_Ua,+1,1467,4,0
post_217713,[Опрос] Рассылка писем: сервис или сервер?,newpdv,+1,1693,8,0
post_216105,Классные скидки или время обзавестись системой хранения данных для HDTV контента,it_man,+1,3424,6,0
post_217705,Вебинар компании Fujitsu «Новый уровень надежности для серверов x86»,Andrew_Kosenko,+1,799,1,0
